[
  {
    "id": "snapshot:clinvar:gene-condition:alzheimer-mondo-0004975:2026-06-07-srid2",
    "source_ids": [
      "source:clinvar"
    ],
    "path": "data/source_snapshots/snapshot%3Aclinvar%3Agene-condition%3Aalzheimer-mondo-0004975%3A2026-06-07-srid2/records.jsonl",
    "accessed_at": "2026-06-07",
    "version": "gene_condition_source_id-2026-06-07-srid2",
    "license_note": "ClinVar gene_condition_source_id filtered to selected Alzheimer's disease genes and MONDO:0004975; source_record_id re-normalized to a single MONDO namespace (2026-06-10). Same underlying 2026-06-07 fetch as the doubled-namespace snapshot.",
    "record_count": 4,
    "sha256": "09c62e862dd1c98e9ab8c8b6fa4c9af5ab490292185b544e4e5180bbc05730cf",
    "freshness": {
      "assessed_at": "2026-06-09",
      "basis": "The fixed ClinVar gene-condition snapshot is acceptable for public-candidate rendering, but paper-grade use should prefer an archived monthly ClinVar release or otherwise documented dated upstream material.",
      "max_age_days": 30,
      "next_review_due": "2026-07-09",
      "paper_grade_blocker": false,
      "status": "refresh_recommended"
    }
  },
  {
    "id": "snapshot:opentargets:alzheimer-associated-targets:2026-06-07:dev5",
    "source_ids": [
      "source:opentargets"
    ],
    "path": "data/source_snapshots/snapshot%3Aopentargets%3Aalzheimer-associated-targets%3A2026-06-07%3Adev5/records.jsonl",
    "accessed_at": "2026-06-07",
    "version": "api-v4-graphql-dev5",
    "license_note": "Open Targets Platform GraphQL API development snapshot; source licensing is represented in release sources.json.",
    "record_count": 5,
    "sha256": "449a228f505c7e92c7d77b313b4245013c815d932725bb5c8d7c7c065c225ba9",
    "freshness": {
      "assessed_at": "2026-06-09",
      "basis": "The fixed Open Targets development snapshot is acceptable for public-candidate rendering, but paper-grade use should refresh from a dated upstream export or documented current source pull.",
      "max_age_days": 30,
      "next_review_due": "2026-07-09",
      "paper_grade_blocker": false,
      "status": "refresh_recommended"
    }
  }
]
