[
  {
    "id": "snapshot:clinvar:gene-condition:dilated-cardiomyopathy-paper120:2026-06-14",
    "source_ids": [
      "source:clinvar"
    ],
    "path": "data/source_snapshots/snapshot%3Aclinvar%3Agene-condition%3Adilated-cardiomyopathy-paper120%3A2026-06-14/records.jsonl",
    "accessed_at": "2026-06-14",
    "version": "gene_condition_source_id-2026-06-14-paper120",
    "license_note": "ClinVar gene_condition_source_id filtered to Dilated cardiomyopathy paper-scale top-120 scope genes and MONDO:0005021.",
    "record_count": 0,
    "sha256": "e3b0c44298fc1c149afbf4c8996fb92427ae41e4649b934ca495991b7852b855",
    "freshness": {
      "assessed_at": "2026-06-09",
      "basis": "The fixed ClinVar gene-condition snapshot is acceptable for public-candidate rendering, but paper-grade use should prefer an archived monthly ClinVar release or otherwise documented dated upstream material.",
      "max_age_days": 30,
      "next_review_due": "2026-07-09",
      "paper_grade_blocker": false,
      "status": "refresh_recommended"
    }
  },
  {
    "id": "snapshot:opentargets:dilated-cardiomyopathy-associated-targets:2026-06-14:paper120",
    "source_ids": [
      "source:opentargets"
    ],
    "path": "data/source_snapshots/snapshot%3Aopentargets%3Adilated-cardiomyopathy-associated-targets%3A2026-06-14%3Apaper120/records.jsonl",
    "accessed_at": "2026-06-14",
    "version": "api-v4-graphql-2026-06-14-paper120",
    "license_note": "Open Targets Platform GraphQL API paper-scale development snapshot (Dilated cardiomyopathy top-120 HGNC-resolved targets from a top-150 fetch window).",
    "record_count": 120,
    "sha256": "c9298ca3b2fe482b3065f38de618a1e1ab401cc6f8e601fc0ea7d4b15344fde1",
    "freshness": {
      "assessed_at": "2026-06-09",
      "basis": "The fixed Open Targets development snapshot is acceptable for public-candidate rendering, but paper-grade use should refresh from a dated upstream export or documented current source pull.",
      "max_age_days": 30,
      "next_review_due": "2026-07-09",
      "paper_grade_blocker": false,
      "status": "refresh_recommended"
    }
  }
]
