[
  {
    "id": "snapshot:clinvar:gene-condition:alzheimer-paper120:2026-06-14",
    "source_ids": [
      "source:clinvar"
    ],
    "path": "data/source_snapshots/snapshot%3Aclinvar%3Agene-condition%3Aalzheimer-paper120%3A2026-06-14/records.jsonl",
    "accessed_at": "2026-06-14",
    "version": "gene_condition_source_id-2026-06-14-paper120",
    "license_note": "ClinVar gene_condition_source_id filtered to Alzheimer disease paper-scale top-120 scope genes and MONDO:0004975.",
    "record_count": 6,
    "sha256": "7a705662c494b117cefff5c02b079851d0038a054bee95851146689b69ca889b",
    "freshness": {
      "assessed_at": "2026-06-09",
      "basis": "The fixed ClinVar gene-condition snapshot is acceptable for public-candidate rendering, but paper-grade use should prefer an archived monthly ClinVar release or otherwise documented dated upstream material.",
      "max_age_days": 30,
      "next_review_due": "2026-07-09",
      "paper_grade_blocker": false,
      "status": "refresh_recommended"
    }
  },
  {
    "id": "snapshot:opentargets:alzheimer-associated-targets:2026-06-14:paper120",
    "source_ids": [
      "source:opentargets"
    ],
    "path": "data/source_snapshots/snapshot%3Aopentargets%3Aalzheimer-associated-targets%3A2026-06-14%3Apaper120/records.jsonl",
    "accessed_at": "2026-06-14",
    "version": "api-v4-graphql-2026-06-14-paper120",
    "license_note": "Open Targets Platform GraphQL API paper-scale development snapshot (Alzheimer disease top-120 HGNC-resolved targets from a top-150 fetch window).",
    "record_count": 120,
    "sha256": "3e83377ce1ecf48bd64e471ae9a5a505bcaf06e40c2dd4043a74b33d6780ff8c",
    "freshness": {
      "assessed_at": "2026-06-09",
      "basis": "The fixed Open Targets development snapshot is acceptable for public-candidate rendering, but paper-grade use should refresh from a dated upstream export or documented current source pull.",
      "max_age_days": 30,
      "next_review_due": "2026-07-09",
      "paper_grade_blocker": false,
      "status": "refresh_recommended"
    }
  }
]
