[
  {
    "id": "snapshot:clinvar:gene-condition:huntington-disease-paper120:2026-06-14",
    "source_ids": [
      "source:clinvar"
    ],
    "path": "data/source_snapshots/snapshot%3Aclinvar%3Agene-condition%3Ahuntington-disease-paper120%3A2026-06-14/records.jsonl",
    "accessed_at": "2026-06-14",
    "version": "gene_condition_source_id-2026-06-14-paper120",
    "license_note": "ClinVar gene_condition_source_id filtered to Huntington disease paper-scale top-120 scope genes and MONDO:0007739.",
    "record_count": 1,
    "sha256": "6dd76ee94395e6ebe4be2d62fbd77edbb36cd8c23b97e5eef5e8fcfdc3b20692",
    "freshness": {
      "assessed_at": "2026-06-09",
      "basis": "The fixed ClinVar gene-condition snapshot is acceptable for public-candidate rendering, but paper-grade use should prefer an archived monthly ClinVar release or otherwise documented dated upstream material.",
      "max_age_days": 30,
      "next_review_due": "2026-07-09",
      "paper_grade_blocker": false,
      "status": "refresh_recommended"
    }
  },
  {
    "id": "snapshot:opentargets:huntington-disease-associated-targets:2026-06-14:paper120",
    "source_ids": [
      "source:opentargets"
    ],
    "path": "data/source_snapshots/snapshot%3Aopentargets%3Ahuntington-disease-associated-targets%3A2026-06-14%3Apaper120/records.jsonl",
    "accessed_at": "2026-06-14",
    "version": "api-v4-graphql-2026-06-14-paper120",
    "license_note": "Open Targets Platform GraphQL API paper-scale development snapshot (Huntington disease top-120 HGNC-resolved targets from a top-150 fetch window).",
    "record_count": 120,
    "sha256": "42d488421ea0f90dedd640b3d03a76e578e43a82a3f9e8ea4ed6e158a3e2ff33",
    "freshness": {
      "assessed_at": "2026-06-09",
      "basis": "The fixed Open Targets development snapshot is acceptable for public-candidate rendering, but paper-grade use should refresh from a dated upstream export or documented current source pull.",
      "max_age_days": 30,
      "next_review_due": "2026-07-09",
      "paper_grade_blocker": false,
      "status": "refresh_recommended"
    }
  }
]
