[
  {
    "id": "snapshot:fixture:opentargets-clinvar",
    "source_ids": [
      "source:opentargets",
      "source:clinvar"
    ],
    "path": "data/fixtures/source_snapshots/opentargets-fixture.jsonl",
    "accessed_at": "2026-06-07",
    "version": "development-placeholder",
    "license_note": "Source metadata placeholder for schema fixture.",
    "record_count": 3,
    "sha256": "e401856ad6c3d35e6012667083e92d1c0c5636a0cc5f66beb283463cf596c9de"
  }
]
