[
  {
    "id": "snapshot:clinvar:gene-condition:alzheimer-mondo-0004975:2026-06-07",
    "source_ids": [
      "source:clinvar"
    ],
    "path": "data/source_snapshots/snapshot%3Aclinvar%3Agene-condition%3Aalzheimer-mondo-0004975%3A2026-06-07/records.jsonl",
    "accessed_at": "2026-06-07",
    "version": "gene_condition_source_id-2026-06-07",
    "license_note": "ClinVar gene_condition_source_id filtered to selected Alzheimer's disease genes and MONDO:0004975.",
    "record_count": 4,
    "sha256": "94981c2720455b8f408ac6adbaa4fb115aa89ed85ada2f01b9d01a279dd7a0da"
  },
  {
    "id": "snapshot:opentargets:alzheimer-associated-targets:2026-06-07:dev5",
    "source_ids": [
      "source:opentargets"
    ],
    "path": "data/source_snapshots/snapshot%3Aopentargets%3Aalzheimer-associated-targets%3A2026-06-07%3Adev5/records.jsonl",
    "accessed_at": "2026-06-07",
    "version": "api-v4-graphql-dev5",
    "license_note": "Open Targets Platform GraphQL API development snapshot; source licensing is represented in release sources.json.",
    "record_count": 5,
    "sha256": "449a228f505c7e92c7d77b313b4245013c815d932725bb5c8d7c7c065c225ba9"
  }
]
